sample_id,sample_name,region,coal_rank,moisture_content,ash_content,sulfur_content,volatile_content,calorific_value,available_quantity,unit_cost,source_title,source_url,source_note
BMK-SEAM-1,BMK 1号煤层样本,Indonesia,lignite,22.08,62.25,0.80,23.91,2155.77,3000,220,"Proximate Analysis, Sulfur, and Calorific Value in Determining Coal Quality","https://www.researchgate.net/publication/383971322_Proximate_Analysis_Sulfur_and_Calorific_Value_in_Determining_Coal_Quality","公开文献摘要给出三层煤样的水分、灰分、挥发分、硫分和发热量；该样本灰分极高，仅用于负样本/限配场景。"
BMK-SEAM-2,BMK 2号煤层样本,Indonesia,bituminous,14.64,6.29,0.37,37.45,7336,6200,610,"Proximate Analysis, Sulfur, and Calorific Value in Determining Coal Quality","https://www.researchgate.net/publication/383971322_Proximate_Analysis_Sulfur_and_Calorific_Value_in_Determining_Coal_Quality","公开文献摘要给出三层煤样的水分、灰分、挥发分、硫分和发热量；该样本低灰低硫高热值。"
BMK-SEAM-3,BMK 3号煤层样本,Indonesia,anthracite,9.71,2.84,0.32,41.87,8207,5200,720,"Proximate Analysis, Sulfur, and Calorific Value in Determining Coal Quality","https://www.researchgate.net/publication/383971322_Proximate_Analysis_Sulfur_and_Calorific_Value_in_Determining_Coal_Quality","公开文献摘要给出三层煤样的水分、灰分、挥发分、硫分和发热量；该样本热值高、硫分低，可作高热值补偿煤。"
ZHUNDONG-WCW-AD,准东五彩湾煤空气干燥基样本,Xinjiang China,low-rank bituminous,11.17,6.43,0.51,27.91,5200,7000,380,"准东五彩湾煤中碱/碱土金属含量及迁移特性试验研究","https://eri.usst.edu.cn/html/2018/4/20180407.htm","文中表1给出五彩湾煤 M_ad=11.17%、A_ad=6.43%、V_ad=27.91%、S_t,ad=0.51%；热值按中等动力煤场景保守设定。"
ZHUNDONG-WCW-AR,准东五彩湾煤收到基样本,Xinjiang China,low-rank bituminous,25.01,3.34,0.28,31.12,4810,8000,350,"涂层对燃用准东煤锅炉受热面沾污特性的影响","https://jns.usst.edu.cn/html/2019/1/20190105.htm","文中表1给出五彩湾煤 M=25.01%、A=3.34%、V=31.12%、S=0.28%、Q_net.ad=20167.07 kJ/kg；折算约4810 kcal/kg。"
